{
  "$schema": "../manifests/themes.schema.json",
  "schemaVersion": 1,
  "generatedAt": "2026-05-04T02:47:31.311787Z",
  "id": "retro-arcade",
  "name": "Retro Arcade",
  "light": {
    "background": "0xFFFDF6E3",
    "foreground": "0xFF073642",
    "card": "0xFFEEE8D5",
    "cardForeground": "0xFF073642",
    "popover": "0xFFEEE8D5",
    "popoverForeground": "0xFF073642",
    "primary": "0xFFD33682",
    "primaryForeground": "0xFFFFFFFF",
    "secondary": "0xFF2AA198",
    "secondaryForeground": "0xFFFFFFFF",
    "muted": "0xFF93A1A1",
    "mutedForeground": "0xFF073642",
    "accent": "0xFFCB4B16",
    "accentForeground": "0xFFFFFFFF",
    "destructive": "0xFFDC322F",
    "destructiveForeground": "0xFFFFFFFF",
    "border": "0xFF839496",
    "input": "0xFF839496",
    "ring": "0xFFD33682",
    "chart1": "0xFF268BD2",
    "chart2": "0xFF2AA198",
    "chart3": "0xFFD33682",
    "chart4": "0xFFCB4B16",
    "chart5": "0xFFDC322F",
    "sidebar": "0xFFFDF6E3",
    "sidebarForeground": "0xFF073642",
    "sidebarPrimary": "0xFFD33682",
    "sidebarPrimaryForeground": "0xFFFFFFFF",
    "sidebarAccent": "0xFF2AA198",
    "sidebarAccentForeground": "0xFFFFFFFF",
    "sidebarBorder": "0xFF839496",
    "sidebarRing": "0xFFD33682"
  },
  "dark": {
    "background": "0xFF002B36",
    "foreground": "0xFF93A1A1",
    "card": "0xFF073642",
    "cardForeground": "0xFF93A1A1",
    "popover": "0xFF073642",
    "popoverForeground": "0xFF93A1A1",
    "primary": "0xFFD33682",
    "primaryForeground": "0xFFFFFFFF",
    "secondary": "0xFF2AA198",
    "secondaryForeground": "0xFFFFFFFF",
    "muted": "0xFF586E75",
    "mutedForeground": "0xFF93A1A1",
    "accent": "0xFFCB4B16",
    "accentForeground": "0xFFFFFFFF",
    "destructive": "0xFFDC322F",
    "destructiveForeground": "0xFFFFFFFF",
    "border": "0xFF586E75",
    "input": "0xFF586E75",
    "ring": "0xFFD33682",
    "chart1": "0xFF268BD2",
    "chart2": "0xFF2AA198",
    "chart3": "0xFFD33682",
    "chart4": "0xFFCB4B16",
    "chart5": "0xFFDC322F",
    "sidebar": "0xFF002B36",
    "sidebarForeground": "0xFF93A1A1",
    "sidebarPrimary": "0xFFD33682",
    "sidebarPrimaryForeground": "0xFFFFFFFF",
    "sidebarAccent": "0xFF2AA198",
    "sidebarAccentForeground": "0xFFFFFFFF",
    "sidebarBorder": "0xFF586E75",
    "sidebarRing": "0xFFD33682"
  },
  "tokens": {
    "light": {
      "radius": 0.25,
      "spacing": {
        "base": 3.84
      },
      "tracking": {
        "normal": 0
      },
      "shadows": {
        "shadow2xs": [
          {
            "x": 2,
            "y": 2,
            "blur": 4,
            "spread": 0,
            "color": "0x2604232F"
          }
        ],
        "shadowXs": [
          {
            "x": 2,
            "y": 2,
            "blur": 4,
            "spread": 0,
            "color": "0x2604232F"
          }
        ],
        "shadowSm": [
          {
            "x": 2,
            "y": 2,
            "blur": 4,
            "spread": 0,
            "color": "0x2604232F"
          }
        ],
        "shadow": [
          {
            "x": 2,
            "y": 2,
            "blur": 4,
            "spread": 0,
            "color": "0x2604232F"
          }
        ],
        "shadowMd": [
          {
            "x": 2,
            "y": 2,
            "blur": 4,
            "spread": 0,
            "color": "0x2604232F"
          }
        ],
        "shadowLg": [
          {
            "x": 2,
            "y": 2,
            "blur": 4,
            "spread": 0,
            "color": "0x2604232F"
          }
        ],
        "shadowXl": [
          {
            "x": 2,
            "y": 2,
            "blur": 4,
            "spread": 0,
            "color": "0x2604232F"
          }
        ],
        "shadow2xl": [
          {
            "x": 2,
            "y": 2,
            "blur": 4,
            "spread": 0,
            "color": "0x2604232F"
          }
        ]
      },
      "fontSans": "Outfit, sans-serif",
      "fontMono": "Space Mono, monospace"
    },
    "dark": {
      "radius": 0.25,
      "spacing": {
        "base": 3.84
      },
      "tracking": {
        "normal": 0
      },
      "shadows": {
        "shadow2xs": [
          {
            "x": 20.5,
            "y": 16.5,
            "blur": 25.5,
            "spread": -30,
            "color": "0x12000000"
          }
        ],
        "shadowXs": [
          {
            "x": 20.5,
            "y": 16.5,
            "blur": 25.5,
            "spread": -30,
            "color": "0x12000000"
          }
        ],
        "shadowSm": [
          {
            "x": 20.5,
            "y": 16.5,
            "blur": 25.5,
            "spread": -30,
            "color": "0x12000000"
          }
        ],
        "shadow": [
          {
            "x": 20.5,
            "y": 16.5,
            "blur": 25.5,
            "spread": -30,
            "color": "0x12000000"
          }
        ],
        "shadowMd": [
          {
            "x": 20.5,
            "y": 16.5,
            "blur": 25.5,
            "spread": -30,
            "color": "0x12000000"
          }
        ],
        "shadowLg": [
          {
            "x": 20.5,
            "y": 16.5,
            "blur": 25.5,
            "spread": -30,
            "color": "0x12000000"
          }
        ],
        "shadowXl": [
          {
            "x": 20.5,
            "y": 16.5,
            "blur": 25.5,
            "spread": -30,
            "color": "0x12000000"
          }
        ],
        "shadow2xl": [
          {
            "x": 20.5,
            "y": 16.5,
            "blur": 25.5,
            "spread": -30,
            "color": "0x12000000"
          }
        ]
      }
    }
  }
}