{
  "$schema": "../manifests/themes.schema.json",
  "schemaVersion": 1,
  "generatedAt": "2026-05-04T02:47:31.311787Z",
  "id": "bold-tech",
  "name": "Bold Tech",
  "light": {
    "background": "0xFFFFFFFF",
    "foreground": "0xFF312E81",
    "card": "0xFFFFFFFF",
    "cardForeground": "0xFF312E81",
    "popover": "0xFFFFFFFF",
    "popoverForeground": "0xFF312E81",
    "primary": "0xFF8B5CF6",
    "primaryForeground": "0xFFFFFFFF",
    "secondary": "0xFFF3F0FF",
    "secondaryForeground": "0xFF4338CA",
    "muted": "0xFFF5F3FF",
    "mutedForeground": "0xFF7C3AED",
    "accent": "0xFFDBEAFE",
    "accentForeground": "0xFF1E40AF",
    "destructive": "0xFFEF4444",
    "destructiveForeground": "0xFFFFFFFF",
    "border": "0xFFE0E7FF",
    "input": "0xFFE0E7FF",
    "ring": "0xFF8B5CF6",
    "chart1": "0xFF8B5CF6",
    "chart2": "0xFF7C3AED",
    "chart3": "0xFF6D28D9",
    "chart4": "0xFF5B21B6",
    "chart5": "0xFF4C1D95",
    "sidebar": "0xFFF5F3FF",
    "sidebarForeground": "0xFF312E81",
    "sidebarPrimary": "0xFF8B5CF6",
    "sidebarPrimaryForeground": "0xFFFFFFFF",
    "sidebarAccent": "0xFFDBEAFE",
    "sidebarAccentForeground": "0xFF1E40AF",
    "sidebarBorder": "0xFFE0E7FF",
    "sidebarRing": "0xFF8B5CF6"
  },
  "dark": {
    "background": "0xFF0F172A",
    "foreground": "0xFFE0E7FF",
    "card": "0xFF1E1B4B",
    "cardForeground": "0xFFE0E7FF",
    "popover": "0xFF1E1B4B",
    "popoverForeground": "0xFFE0E7FF",
    "primary": "0xFF8B5CF6",
    "primaryForeground": "0xFFFFFFFF",
    "secondary": "0xFF1E1B4B",
    "secondaryForeground": "0xFFE0E7FF",
    "muted": "0xFF171447",
    "mutedForeground": "0xFFC4B5FD",
    "accent": "0xFF4338CA",
    "accentForeground": "0xFFE0E7FF",
    "destructive": "0xFFEF4444",
    "destructiveForeground": "0xFFFFFFFF",
    "border": "0xFF2E1065",
    "input": "0xFF2E1065",
    "ring": "0xFF8B5CF6",
    "chart1": "0xFFA78BFA",
    "chart2": "0xFF8B5CF6",
    "chart3": "0xFF7C3AED",
    "chart4": "0xFF6D28D9",
    "chart5": "0xFF5B21B6",
    "sidebar": "0xFF0F172A",
    "sidebarForeground": "0xFFE0E7FF",
    "sidebarPrimary": "0xFF8B5CF6",
    "sidebarPrimaryForeground": "0xFFFFFFFF",
    "sidebarAccent": "0xFF4338CA",
    "sidebarAccentForeground": "0xFFE0E7FF",
    "sidebarBorder": "0xFF2E1065",
    "sidebarRing": "0xFF8B5CF6"
  },
  "tokens": {
    "light": {
      "radius": 0.625,
      "spacing": {
        "base": 3.84
      },
      "tracking": {
        "normal": 0
      },
      "shadows": {
        "shadow2xs": [
          {
            "x": 2,
            "y": 2,
            "blur": 4,
            "spread": 0,
            "color": "0x33835EF3"
          }
        ],
        "shadowXs": [
          {
            "x": 2,
            "y": 2,
            "blur": 4,
            "spread": 0,
            "color": "0x33835EF3"
          }
        ],
        "shadowSm": [
          {
            "x": 2,
            "y": 2,
            "blur": 4,
            "spread": 0,
            "color": "0x33835EF3"
          }
        ],
        "shadow": [
          {
            "x": 2,
            "y": 2,
            "blur": 4,
            "spread": 0,
            "color": "0x33835EF3"
          }
        ],
        "shadowMd": [
          {
            "x": 2,
            "y": 2,
            "blur": 4,
            "spread": 0,
            "color": "0x33835EF3"
          }
        ],
        "shadowLg": [
          {
            "x": 2,
            "y": 2,
            "blur": 4,
            "spread": 0,
            "color": "0x33835EF3"
          }
        ],
        "shadowXl": [
          {
            "x": 2,
            "y": 2,
            "blur": 4,
            "spread": 0,
            "color": "0x33835EF3"
          }
        ],
        "shadow2xl": [
          {
            "x": 2,
            "y": 2,
            "blur": 4,
            "spread": 0,
            "color": "0x33835EF3"
          }
        ]
      },
      "fontSans": "Roboto, sans-serif",
      "fontSerif": "Playfair Display, serif",
      "fontMono": "Fira Code, monospace"
    },
    "dark": {
      "radius": 0.625,
      "spacing": {
        "base": 3.84
      },
      "tracking": {
        "normal": 0
      },
      "shadows": {
        "shadow2xs": [
          {
            "x": 20.5,
            "y": 16.5,
            "blur": 25.5,
            "spread": -30,
            "color": "0x12000000"
          }
        ],
        "shadowXs": [
          {
            "x": 20.5,
            "y": 16.5,
            "blur": 25.5,
            "spread": -30,
            "color": "0x12000000"
          }
        ],
        "shadowSm": [
          {
            "x": 20.5,
            "y": 16.5,
            "blur": 25.5,
            "spread": -30,
            "color": "0x12000000"
          }
        ],
        "shadow": [
          {
            "x": 20.5,
            "y": 16.5,
            "blur": 25.5,
            "spread": -30,
            "color": "0x12000000"
          }
        ],
        "shadowMd": [
          {
            "x": 20.5,
            "y": 16.5,
            "blur": 25.5,
            "spread": -30,
            "color": "0x12000000"
          }
        ],
        "shadowLg": [
          {
            "x": 20.5,
            "y": 16.5,
            "blur": 25.5,
            "spread": -30,
            "color": "0x12000000"
          }
        ],
        "shadowXl": [
          {
            "x": 20.5,
            "y": 16.5,
            "blur": 25.5,
            "spread": -30,
            "color": "0x12000000"
          }
        ],
        "shadow2xl": [
          {
            "x": 20.5,
            "y": 16.5,
            "blur": 25.5,
            "spread": -30,
            "color": "0x12000000"
          }
        ]
      }
    }
  }
}