{
  "$schema": "../manifests/themes.schema.json",
  "schemaVersion": 1,
  "generatedAt": "2026-05-04T02:47:31.311787Z",
  "id": "supabase",
  "name": "Supabase",
  "light": {
    "background": "0xFFFCFCFC",
    "foreground": "0xFF171717",
    "card": "0xFFFCFCFC",
    "cardForeground": "0xFF171717",
    "popover": "0xFFFCFCFC",
    "popoverForeground": "0xFF525252",
    "primary": "0xFF72E3AD",
    "primaryForeground": "0xFF1E2723",
    "secondary": "0xFFFDFDFD",
    "secondaryForeground": "0xFF171717",
    "muted": "0xFFEDEDED",
    "mutedForeground": "0xFF202020",
    "accent": "0xFFEDEDED",
    "accentForeground": "0xFF202020",
    "destructive": "0xFFCA3214",
    "destructiveForeground": "0xFFFFFCFC",
    "border": "0xFFDFDFDF",
    "input": "0xFFF6F6F6",
    "ring": "0xFF72E3AD",
    "chart1": "0xFF72E3AD",
    "chart2": "0xFF3B82F6",
    "chart3": "0xFF8B5CF6",
    "chart4": "0xFFF59E0B",
    "chart5": "0xFF10B981",
    "sidebar": "0xFFFCFCFC",
    "sidebarForeground": "0xFF707070",
    "sidebarPrimary": "0xFF72E3AD",
    "sidebarPrimaryForeground": "0xFF1E2723",
    "sidebarAccent": "0xFFEDEDED",
    "sidebarAccentForeground": "0xFF202020",
    "sidebarBorder": "0xFFDFDFDF",
    "sidebarRing": "0xFF72E3AD"
  },
  "dark": {
    "background": "0xFF121212",
    "foreground": "0xFFE2E8F0",
    "card": "0xFF171717",
    "cardForeground": "0xFFE2E8F0",
    "popover": "0xFF242424",
    "popoverForeground": "0xFFA9A9A9",
    "primary": "0xFF006239",
    "primaryForeground": "0xFFDDE8E3",
    "secondary": "0xFF242424",
    "secondaryForeground": "0xFFFAFAFA",
    "muted": "0xFF1F1F1F",
    "mutedForeground": "0xFFA2A2A2",
    "accent": "0xFF313131",
    "accentForeground": "0xFFFAFAFA",
    "destructive": "0xFF541C15",
    "destructiveForeground": "0xFFEDE9E8",
    "border": "0xFF292929",
    "input": "0xFF242424",
    "ring": "0xFF4ADE80",
    "chart1": "0xFF4ADE80",
    "chart2": "0xFF60A5FA",
    "chart3": "0xFFA78BFA",
    "chart4": "0xFFFBBF24",
    "chart5": "0xFF2DD4BF",
    "sidebar": "0xFF121212",
    "sidebarForeground": "0xFF898989",
    "sidebarPrimary": "0xFF006239",
    "sidebarPrimaryForeground": "0xFFDDE8E3",
    "sidebarAccent": "0xFF313131",
    "sidebarAccentForeground": "0xFFFAFAFA",
    "sidebarBorder": "0xFF292929",
    "sidebarRing": "0xFF4ADE80"
  },
  "tokens": {
    "light": {
      "radius": 0.5,
      "spacing": {
        "base": 3.84
      },
      "tracking": {
        "normal": 0.4
      },
      "shadows": {
        "shadow2xs": [
          {
            "x": 0,
            "y": 1,
            "blur": 3,
            "spread": 0,
            "color": "0x2B000000"
          }
        ],
        "shadowXs": [
          {
            "x": 0,
            "y": 1,
            "blur": 3,
            "spread": 0,
            "color": "0x2B000000"
          }
        ],
        "shadowSm": [
          {
            "x": 0,
            "y": 1,
            "blur": 3,
            "spread": 0,
            "color": "0x2B000000"
          }
        ],
        "shadow": [
          {
            "x": 0,
            "y": 1,
            "blur": 3,
            "spread": 0,
            "color": "0x2B000000"
          }
        ],
        "shadowMd": [
          {
            "x": 0,
            "y": 1,
            "blur": 3,
            "spread": 0,
            "color": "0x2B000000"
          }
        ],
        "shadowLg": [
          {
            "x": 0,
            "y": 1,
            "blur": 3,
            "spread": 0,
            "color": "0x2B000000"
          }
        ],
        "shadowXl": [
          {
            "x": 0,
            "y": 1,
            "blur": 3,
            "spread": 0,
            "color": "0x2B000000"
          }
        ],
        "shadow2xl": [
          {
            "x": 0,
            "y": 1,
            "blur": 3,
            "spread": 0,
            "color": "0x2B000000"
          }
        ]
      },
      "fontSans": "Outfit, sans-serif",
      "fontSerif": "ui-serif, Georgia, Cambria, \\",
      "fontMono": "monospace"
    },
    "dark": {
      "radius": 0.5,
      "spacing": {
        "base": 3.84
      },
      "tracking": {
        "normal": 0
      },
      "shadows": {
        "shadow2xs": [
          {
            "x": 20.5,
            "y": 16.5,
            "blur": 25.5,
            "spread": -30,
            "color": "0x12000000"
          }
        ],
        "shadowXs": [
          {
            "x": 20.5,
            "y": 16.5,
            "blur": 25.5,
            "spread": -30,
            "color": "0x12000000"
          }
        ],
        "shadowSm": [
          {
            "x": 20.5,
            "y": 16.5,
            "blur": 25.5,
            "spread": -30,
            "color": "0x12000000"
          }
        ],
        "shadow": [
          {
            "x": 20.5,
            "y": 16.5,
            "blur": 25.5,
            "spread": -30,
            "color": "0x12000000"
          }
        ],
        "shadowMd": [
          {
            "x": 20.5,
            "y": 16.5,
            "blur": 25.5,
            "spread": -30,
            "color": "0x12000000"
          }
        ],
        "shadowLg": [
          {
            "x": 20.5,
            "y": 16.5,
            "blur": 25.5,
            "spread": -30,
            "color": "0x12000000"
          }
        ],
        "shadowXl": [
          {
            "x": 20.5,
            "y": 16.5,
            "blur": 25.5,
            "spread": -30,
            "color": "0x12000000"
          }
        ],
        "shadow2xl": [
          {
            "x": 20.5,
            "y": 16.5,
            "blur": 25.5,
            "spread": -30,
            "color": "0x12000000"
          }
        ]
      }
    }
  }
}