{
  "$schema": "../manifests/themes.schema.json",
  "schemaVersion": 1,
  "generatedAt": "2026-02-20T02:59:20.595197Z",
  "id": "pastel-dreams",
  "name": "Pastel Dreams",
  "light": {
    "background": "0xFFF7F3F9",
    "foreground": "0xFF374151",
    "card": "0xFFFFFFFF",
    "cardForeground": "0xFF374151",
    "popover": "0xFFFFFFFF",
    "popoverForeground": "0xFF374151",
    "primary": "0xFFA78BFA",
    "primaryForeground": "0xFFFFFFFF",
    "secondary": "0xFFE9D8FD",
    "secondaryForeground": "0xFF4B5563",
    "muted": "0xFFF3E8FF",
    "mutedForeground": "0xFF6B7280",
    "accent": "0xFFF3E5F5",
    "accentForeground": "0xFF374151",
    "destructive": "0xFFFCA5A5",
    "destructiveForeground": "0xFFFFFFFF",
    "border": "0xFFE9D8FD",
    "input": "0xFFE9D8FD",
    "ring": "0xFFA78BFA",
    "chart1": "0xFFA78BFA",
    "chart2": "0xFF8B5CF6",
    "chart3": "0xFF7C3AED",
    "chart4": "0xFF6D28D9",
    "chart5": "0xFF5B21B6",
    "sidebar": "0xFFE9D8FD",
    "sidebarForeground": "0xFF374151",
    "sidebarPrimary": "0xFFA78BFA",
    "sidebarPrimaryForeground": "0xFFFFFFFF",
    "sidebarAccent": "0xFFF3E5F5",
    "sidebarAccentForeground": "0xFF374151",
    "sidebarBorder": "0xFFE9D8FD",
    "sidebarRing": "0xFFA78BFA"
  },
  "dark": {
    "background": "0xFF1C1917",
    "foreground": "0xFFE0E7FF",
    "card": "0xFF2D2535",
    "cardForeground": "0xFFE0E7FF",
    "popover": "0xFF2D2535",
    "popoverForeground": "0xFFE0E7FF",
    "primary": "0xFFC0AAFD",
    "primaryForeground": "0xFF1C1917",
    "secondary": "0xFF3F324A",
    "secondaryForeground": "0xFFD1D5DB",
    "muted": "0xFF20182B",
    "mutedForeground": "0xFF9CA3AF",
    "accent": "0xFF4A3D5A",
    "accentForeground": "0xFFD1D5DB",
    "destructive": "0xFFFCA5A5",
    "destructiveForeground": "0xFF1C1917",
    "border": "0xFF3F324A",
    "input": "0xFF3F324A",
    "ring": "0xFFC0AAFD",
    "chart1": "0xFFC0AAFD",
    "chart2": "0xFFA78BFA",
    "chart3": "0xFF8B5CF6",
    "chart4": "0xFF7C3AED",
    "chart5": "0xFF6D28D9",
    "sidebar": "0xFF3F324A",
    "sidebarForeground": "0xFFE0E7FF",
    "sidebarPrimary": "0xFFC0AAFD",
    "sidebarPrimaryForeground": "0xFF1C1917",
    "sidebarAccent": "0xFF4A3D5A",
    "sidebarAccentForeground": "0xFFD1D5DB",
    "sidebarBorder": "0xFF3F324A",
    "sidebarRing": "0xFFC0AAFD"
  },
  "tokens": {
    "light": {
      "radius": 1.5,
      "spacing": {
        "base": 3.84
      },
      "tracking": {
        "normal": 0
      },
      "shadows": {
        "shadow2xs": [
          {
            "x": 0,
            "y": 8,
            "blur": 16,
            "spread": -4,
            "color": "0x14000000"
          }
        ],
        "shadowXs": [
          {
            "x": 0,
            "y": 8,
            "blur": 16,
            "spread": -4,
            "color": "0x14000000"
          }
        ],
        "shadowSm": [
          {
            "x": 0,
            "y": 8,
            "blur": 16,
            "spread": -4,
            "color": "0x14000000"
          }
        ],
        "shadow": [
          {
            "x": 0,
            "y": 8,
            "blur": 16,
            "spread": -4,
            "color": "0x14000000"
          }
        ],
        "shadowMd": [
          {
            "x": 0,
            "y": 8,
            "blur": 16,
            "spread": -4,
            "color": "0x14000000"
          }
        ],
        "shadowLg": [
          {
            "x": 0,
            "y": 8,
            "blur": 16,
            "spread": -4,
            "color": "0x14000000"
          }
        ],
        "shadowXl": [
          {
            "x": 0,
            "y": 8,
            "blur": 16,
            "spread": -4,
            "color": "0x14000000"
          }
        ],
        "shadow2xl": [
          {
            "x": 0,
            "y": 8,
            "blur": 16,
            "spread": -4,
            "color": "0x14000000"
          }
        ]
      },
      "fontSans": "Open Sans, sans-serif",
      "fontSerif": "Source Serif 4, serif",
      "fontMono": "IBM Plex Mono, monospace"
    },
    "dark": {
      "radius": 1.5,
      "spacing": {
        "base": 3.84
      },
      "tracking": {
        "normal": 0
      },
      "shadows": {
        "shadow2xs": [
          {
            "x": 20.5,
            "y": 16.5,
            "blur": 25.5,
            "spread": -30,
            "color": "0x12000000"
          }
        ],
        "shadowXs": [
          {
            "x": 20.5,
            "y": 16.5,
            "blur": 25.5,
            "spread": -30,
            "color": "0x12000000"
          }
        ],
        "shadowSm": [
          {
            "x": 20.5,
            "y": 16.5,
            "blur": 25.5,
            "spread": -30,
            "color": "0x12000000"
          }
        ],
        "shadow": [
          {
            "x": 20.5,
            "y": 16.5,
            "blur": 25.5,
            "spread": -30,
            "color": "0x12000000"
          }
        ],
        "shadowMd": [
          {
            "x": 20.5,
            "y": 16.5,
            "blur": 25.5,
            "spread": -30,
            "color": "0x12000000"
          }
        ],
        "shadowLg": [
          {
            "x": 20.5,
            "y": 16.5,
            "blur": 25.5,
            "spread": -30,
            "color": "0x12000000"
          }
        ],
        "shadowXl": [
          {
            "x": 20.5,
            "y": 16.5,
            "blur": 25.5,
            "spread": -30,
            "color": "0x12000000"
          }
        ],
        "shadow2xl": [
          {
            "x": 20.5,
            "y": 16.5,
            "blur": 25.5,
            "spread": -30,
            "color": "0x12000000"
          }
        ]
      }
    }
  }
}