{
  "$schema": "../manifests/themes.schema.json",
  "schemaVersion": 1,
  "generatedAt": "2026-05-04T02:47:31.311787Z",
  "id": "bubblegum",
  "name": "Bubblegum",
  "light": {
    "background": "0xFFF6E6EE",
    "foreground": "0xFF5B5B5B",
    "card": "0xFFFDEDC9",
    "cardForeground": "0xFF5B5B5B",
    "popover": "0xFFFFFFFF",
    "popoverForeground": "0xFF5B5B5B",
    "primary": "0xFFD04F99",
    "primaryForeground": "0xFFFFFFFF",
    "secondary": "0xFF8ACFD1",
    "secondaryForeground": "0xFF333333",
    "muted": "0xFFB2E1EB",
    "mutedForeground": "0xFF7A7A7A",
    "accent": "0xFFFBE2A7",
    "accentForeground": "0xFF333333",
    "destructive": "0xFFF96F70",
    "destructiveForeground": "0xFFFFFFFF",
    "border": "0xFFD04F99",
    "input": "0xFFE4E4E4",
    "ring": "0xFFE670AB",
    "chart1": "0xFFE670AB",
    "chart2": "0xFF84D2E2",
    "chart3": "0xFFFBE2A7",
    "chart4": "0xFFF3A0CA",
    "chart5": "0xFFD7488E",
    "sidebar": "0xFFF8D8EA",
    "sidebarForeground": "0xFF333333",
    "sidebarPrimary": "0xFFEC4899",
    "sidebarPrimaryForeground": "0xFFFFFFFF",
    "sidebarAccent": "0xFFF9A8D4",
    "sidebarAccentForeground": "0xFF333333",
    "sidebarBorder": "0xFFF3E8FF",
    "sidebarRing": "0xFFEC4899"
  },
  "dark": {
    "background": "0xFF12242E",
    "foreground": "0xFFF3E3EA",
    "card": "0xFF1C2E38",
    "cardForeground": "0xFFF3E3EA",
    "popover": "0xFF1C2E38",
    "popoverForeground": "0xFFF3E3EA",
    "primary": "0xFFFBE2A7",
    "primaryForeground": "0xFF12242E",
    "secondary": "0xFFE4A2B1",
    "secondaryForeground": "0xFF12242E",
    "muted": "0xFF24272B",
    "mutedForeground": "0xFFE4A2B1",
    "accent": "0xFFC67B96",
    "accentForeground": "0xFFF3E3EA",
    "destructive": "0xFFE35EA4",
    "destructiveForeground": "0xFF12242E",
    "border": "0xFF324859",
    "input": "0xFF20333D",
    "ring": "0xFF50AFB6",
    "chart1": "0xFF50AFB6",
    "chart2": "0xFFE4A2B1",
    "chart3": "0xFFC67B96",
    "chart4": "0xFF175C6C",
    "chart5": "0xFF24272B",
    "sidebar": "0xFF101F28",
    "sidebarForeground": "0xFFF3F4F6",
    "sidebarPrimary": "0xFFEC4899",
    "sidebarPrimaryForeground": "0xFFFFFFFF",
    "sidebarAccent": "0xFFF9A8D4",
    "sidebarAccentForeground": "0xFF1F2937",
    "sidebarBorder": "0xFF374151",
    "sidebarRing": "0xFFEC4899"
  },
  "tokens": {
    "light": {
      "radius": 0.4,
      "spacing": {
        "base": 3.84
      },
      "tracking": {
        "normal": 0
      },
      "shadows": {
        "shadow2xs": [
          {
            "x": 3,
            "y": 3,
            "blur": 0,
            "spread": 0,
            "color": "0x80D1519A"
          }
        ],
        "shadowXs": [
          {
            "x": 3,
            "y": 3,
            "blur": 0,
            "spread": 0,
            "color": "0x80D1519A"
          }
        ],
        "shadowSm": [
          {
            "x": 3,
            "y": 3,
            "blur": 0,
            "spread": 0,
            "color": "0x80D1519A"
          }
        ],
        "shadow": [
          {
            "x": 3,
            "y": 3,
            "blur": 0,
            "spread": 0,
            "color": "0x80D1519A"
          }
        ],
        "shadowMd": [
          {
            "x": 3,
            "y": 3,
            "blur": 0,
            "spread": 0,
            "color": "0x80D1519A"
          }
        ],
        "shadowLg": [
          {
            "x": 3,
            "y": 3,
            "blur": 0,
            "spread": 0,
            "color": "0x80D1519A"
          }
        ],
        "shadowXl": [
          {
            "x": 3,
            "y": 3,
            "blur": 0,
            "spread": 0,
            "color": "0x80D1519A"
          }
        ],
        "shadow2xl": [
          {
            "x": 3,
            "y": 3,
            "blur": 0,
            "spread": 0,
            "color": "0x80D1519A"
          }
        ]
      },
      "fontSans": "Poppins, sans-serif",
      "fontSerif": "Lora, serif",
      "fontMono": "Fira Code, monospace"
    },
    "dark": {
      "radius": 0.5,
      "spacing": {
        "base": 3.84
      },
      "tracking": {
        "normal": 0
      },
      "shadows": {
        "shadow2xs": [
          {
            "x": 0,
            "y": 0,
            "blur": 0,
            "spread": 0,
            "color": "0xFF324859"
          }
        ],
        "shadowXs": [
          {
            "x": 0,
            "y": 0,
            "blur": 0,
            "spread": 0,
            "color": "0xFF324859"
          }
        ],
        "shadowSm": [
          {
            "x": 0,
            "y": 0,
            "blur": 0,
            "spread": 0,
            "color": "0xFF324859"
          }
        ],
        "shadow": [
          {
            "x": 0,
            "y": 0,
            "blur": 0,
            "spread": 0,
            "color": "0xFF324859"
          }
        ],
        "shadowMd": [
          {
            "x": 0,
            "y": 0,
            "blur": 0,
            "spread": 0,
            "color": "0xFF324859"
          }
        ],
        "shadowLg": [
          {
            "x": 0,
            "y": 0,
            "blur": 0,
            "spread": 0,
            "color": "0xFF324859"
          }
        ],
        "shadowXl": [
          {
            "x": 0,
            "y": 0,
            "blur": 0,
            "spread": 0,
            "color": "0xFF324859"
          }
        ],
        "shadow2xl": [
          {
            "x": 0,
            "y": 0,
            "blur": 0,
            "spread": 0,
            "color": "0xFF324859"
          }
        ]
      },
      "fontSans": "Poppins, sans-serif",
      "fontSerif": "Lora, serif",
      "fontMono": "Fira Code, monospace"
    }
  }
}