{
  "$schema": "../manifests/themes.schema.json",
  "schemaVersion": 1,
  "generatedAt": "2026-05-04T02:47:31.311787Z",
  "id": "elegant-luxury",
  "name": "Elegant Luxury",
  "light": {
    "background": "0xFFFAF7F5",
    "foreground": "0xFF1A1A1A",
    "card": "0xFFFAF7F5",
    "cardForeground": "0xFF1A1A1A",
    "popover": "0xFFFAF7F5",
    "popoverForeground": "0xFF1A1A1A",
    "primary": "0xFF9B2C2C",
    "primaryForeground": "0xFFFFFFFF",
    "secondary": "0xFFFDF2D6",
    "secondaryForeground": "0xFF805500",
    "muted": "0xFFF0EBE8",
    "mutedForeground": "0xFF57534E",
    "accent": "0xFFFEF3C7",
    "accentForeground": "0xFF7F1D1D",
    "destructive": "0xFF991B1B",
    "destructiveForeground": "0xFFFFFFFF",
    "border": "0xFFF5E8D2",
    "input": "0xFFF5E8D2",
    "ring": "0xFF9B2C2C",
    "chart1": "0xFFB91C1C",
    "chart2": "0xFF9B2C2C",
    "chart3": "0xFF7F1D1D",
    "chart4": "0xFFB45309",
    "chart5": "0xFF92400E",
    "sidebar": "0xFFF0EBE8",
    "sidebarForeground": "0xFF1A1A1A",
    "sidebarPrimary": "0xFF9B2C2C",
    "sidebarPrimaryForeground": "0xFFFFFFFF",
    "sidebarAccent": "0xFFFEF3C7",
    "sidebarAccentForeground": "0xFF7F1D1D",
    "sidebarBorder": "0xFFF5E8D2",
    "sidebarRing": "0xFF9B2C2C"
  },
  "dark": {
    "background": "0xFF1C1917",
    "foreground": "0xFFF5F5F4",
    "card": "0xFF292524",
    "cardForeground": "0xFFF5F5F4",
    "popover": "0xFF292524",
    "popoverForeground": "0xFFF5F5F4",
    "primary": "0xFFB91C1C",
    "primaryForeground": "0xFFFAF7F5",
    "secondary": "0xFF92400E",
    "secondaryForeground": "0xFFFEF3C7",
    "muted": "0xFF1F1C1A",
    "mutedForeground": "0xFFD6D3D1",
    "accent": "0xFFB45309",
    "accentForeground": "0xFFFEF3C7",
    "destructive": "0xFFEF4444",
    "destructiveForeground": "0xFFFFFFFF",
    "border": "0xFF44403C",
    "input": "0xFF44403C",
    "ring": "0xFFB91C1C",
    "chart1": "0xFFF87171",
    "chart2": "0xFFEF4444",
    "chart3": "0xFFDC2626",
    "chart4": "0xFFFBBF24",
    "chart5": "0xFFF59E0B",
    "sidebar": "0xFF1C1917",
    "sidebarForeground": "0xFFF5F5F4",
    "sidebarPrimary": "0xFFB91C1C",
    "sidebarPrimaryForeground": "0xFFFAF7F5",
    "sidebarAccent": "0xFFB45309",
    "sidebarAccentForeground": "0xFFFEF3C7",
    "sidebarBorder": "0xFF44403C",
    "sidebarRing": "0xFFB91C1C"
  },
  "tokens": {
    "light": {
      "radius": 0.375,
      "spacing": {
        "base": 3.84
      },
      "tracking": {
        "normal": 0
      },
      "shadows": {
        "shadow2xs": [
          {
            "x": 1,
            "y": 1,
            "blur": 16,
            "spread": -2,
            "color": "0x1F4B1111"
          }
        ],
        "shadowXs": [
          {
            "x": 1,
            "y": 1,
            "blur": 16,
            "spread": -2,
            "color": "0x1F4B1111"
          }
        ],
        "shadowSm": [
          {
            "x": 1,
            "y": 1,
            "blur": 16,
            "spread": -2,
            "color": "0x1F4B1111"
          }
        ],
        "shadow": [
          {
            "x": 1,
            "y": 1,
            "blur": 16,
            "spread": -2,
            "color": "0x1F4B1111"
          }
        ],
        "shadowMd": [
          {
            "x": 1,
            "y": 1,
            "blur": 16,
            "spread": -2,
            "color": "0x1F4B1111"
          }
        ],
        "shadowLg": [
          {
            "x": 1,
            "y": 1,
            "blur": 16,
            "spread": -2,
            "color": "0x1F4B1111"
          }
        ],
        "shadowXl": [
          {
            "x": 1,
            "y": 1,
            "blur": 16,
            "spread": -2,
            "color": "0x1F4B1111"
          }
        ],
        "shadow2xl": [
          {
            "x": 1,
            "y": 1,
            "blur": 16,
            "spread": -2,
            "color": "0x1F4B1111"
          }
        ]
      },
      "fontSans": "Poppins, sans-serif",
      "fontSerif": "Libre Baskerville, serif",
      "fontMono": "IBM Plex Mono, monospace"
    },
    "dark": {
      "radius": 0.375,
      "spacing": {
        "base": 3.84
      },
      "tracking": {
        "normal": 0
      },
      "shadows": {
        "shadow2xs": [
          {
            "x": 20.5,
            "y": 16.5,
            "blur": 25.5,
            "spread": -30,
            "color": "0x12000000"
          }
        ],
        "shadowXs": [
          {
            "x": 20.5,
            "y": 16.5,
            "blur": 25.5,
            "spread": -30,
            "color": "0x12000000"
          }
        ],
        "shadowSm": [
          {
            "x": 20.5,
            "y": 16.5,
            "blur": 25.5,
            "spread": -30,
            "color": "0x12000000"
          }
        ],
        "shadow": [
          {
            "x": 20.5,
            "y": 16.5,
            "blur": 25.5,
            "spread": -30,
            "color": "0x12000000"
          }
        ],
        "shadowMd": [
          {
            "x": 20.5,
            "y": 16.5,
            "blur": 25.5,
            "spread": -30,
            "color": "0x12000000"
          }
        ],
        "shadowLg": [
          {
            "x": 20.5,
            "y": 16.5,
            "blur": 25.5,
            "spread": -30,
            "color": "0x12000000"
          }
        ],
        "shadowXl": [
          {
            "x": 20.5,
            "y": 16.5,
            "blur": 25.5,
            "spread": -30,
            "color": "0x12000000"
          }
        ],
        "shadow2xl": [
          {
            "x": 20.5,
            "y": 16.5,
            "blur": 25.5,
            "spread": -30,
            "color": "0x12000000"
          }
        ]
      }
    }
  }
}