{
  "$schema": "../manifests/themes.schema.json",
  "schemaVersion": 1,
  "generatedAt": "2026-05-04T02:47:31.311787Z",
  "id": "notebook",
  "name": "Notebook",
  "light": {
    "background": "0xFFF9F9F9",
    "foreground": "0xFF3A3A3A",
    "card": "0xFFFFFFFF",
    "cardForeground": "0xFF3A3A3A",
    "popover": "0xFFFFFFFF",
    "popoverForeground": "0xFF3A3A3A",
    "primary": "0xFF606060",
    "primaryForeground": "0xFFF0F0F0",
    "secondary": "0xFFDEDEDE",
    "secondaryForeground": "0xFF3A3A3A",
    "muted": "0xFFE3E3E3",
    "mutedForeground": "0xFF505050",
    "accent": "0xFFF3EAC8",
    "accentForeground": "0xFF5D4037",
    "destructive": "0xFFC87A7A",
    "destructiveForeground": "0xFFFFFFFF",
    "border": "0xFF747272",
    "input": "0xFFFFFFFF",
    "ring": "0xFFA0A0A0",
    "chart1": "0xFF333333",
    "chart2": "0xFF555555",
    "chart3": "0xFF777777",
    "chart4": "0xFF999999",
    "chart5": "0xFFBBBBBB",
    "sidebar": "0xFFF0F0F0",
    "sidebarForeground": "0xFF3A3A3A",
    "sidebarPrimary": "0xFF606060",
    "sidebarPrimaryForeground": "0xFFF0F0F0",
    "sidebarAccent": "0xFFF3EAC8",
    "sidebarAccentForeground": "0xFF5D4037",
    "sidebarBorder": "0xFFC0C0C0",
    "sidebarRing": "0xFFA0A0A0"
  },
  "dark": {
    "background": "0xFF2B2B2B",
    "foreground": "0xFFDCDCDC",
    "card": "0xFF333333",
    "cardForeground": "0xFFDCDCDC",
    "popover": "0xFF333333",
    "popoverForeground": "0xFFDCDCDC",
    "primary": "0xFFB0B0B0",
    "primaryForeground": "0xFF2B2B2B",
    "secondary": "0xFF5A5A5A",
    "secondaryForeground": "0xFFC0C0C0",
    "muted": "0xFF454545",
    "mutedForeground": "0xFFA0A0A0",
    "accent": "0xFFE0E0E0",
    "accentForeground": "0xFF333333",
    "destructive": "0xFFD9AFAF",
    "destructiveForeground": "0xFF2B2B2B",
    "border": "0xFF4F4F4F",
    "input": "0xFF333333",
    "ring": "0xFFC0C0C0",
    "chart1": "0xFFEFEFEF",
    "chart2": "0xFFD0D0D0",
    "chart3": "0xFFB0B0B0",
    "chart4": "0xFF909090",
    "chart5": "0xFF707070",
    "sidebar": "0xFF212121",
    "sidebarForeground": "0xFFDCDCDC",
    "sidebarPrimary": "0xFFB0B0B0",
    "sidebarPrimaryForeground": "0xFF212121",
    "sidebarAccent": "0xFFE0E0E0",
    "sidebarAccentForeground": "0xFF333333",
    "sidebarBorder": "0xFF4F4F4F",
    "sidebarRing": "0xFFC0C0C0"
  },
  "tokens": {
    "light": {
      "radius": 0.625,
      "spacing": {
        "base": 4
      },
      "tracking": {
        "normal": 0.5
      },
      "shadows": {
        "shadow2xs": [
          {
            "x": 1,
            "y": 4,
            "blur": 5,
            "spread": 0,
            "color": "0x08000000"
          }
        ],
        "shadowXs": [
          {
            "x": 1,
            "y": 4,
            "blur": 5,
            "spread": 0,
            "color": "0x08000000"
          }
        ],
        "shadowSm": [
          {
            "x": 1,
            "y": 4,
            "blur": 5,
            "spread": 0,
            "color": "0x08000000"
          }
        ],
        "shadow": [
          {
            "x": 1,
            "y": 4,
            "blur": 5,
            "spread": 0,
            "color": "0x08000000"
          }
        ],
        "shadowMd": [
          {
            "x": 1,
            "y": 4,
            "blur": 5,
            "spread": 0,
            "color": "0x08000000"
          }
        ],
        "shadowLg": [
          {
            "x": 1,
            "y": 4,
            "blur": 5,
            "spread": 0,
            "color": "0x08000000"
          }
        ],
        "shadowXl": [
          {
            "x": 1,
            "y": 4,
            "blur": 5,
            "spread": 0,
            "color": "0x08000000"
          }
        ],
        "shadow2xl": [
          {
            "x": 1,
            "y": 4,
            "blur": 5,
            "spread": 0,
            "color": "0x08000000"
          }
        ]
      },
      "fontSans": "Architects Daughter, sans-serif",
      "fontSerif": "\\",
      "fontMono": "\\"
    },
    "dark": {
      "radius": 0.625,
      "spacing": {
        "base": 4
      },
      "tracking": {
        "normal": 0.5
      },
      "shadows": {
        "shadow2xs": [
          {
            "x": 1,
            "y": 4,
            "blur": 5,
            "spread": 0,
            "color": "0x08000000"
          }
        ],
        "shadowXs": [
          {
            "x": 1,
            "y": 4,
            "blur": 5,
            "spread": 0,
            "color": "0x08000000"
          }
        ],
        "shadowSm": [
          {
            "x": 1,
            "y": 4,
            "blur": 5,
            "spread": 0,
            "color": "0x08000000"
          }
        ],
        "shadow": [
          {
            "x": 1,
            "y": 4,
            "blur": 5,
            "spread": 0,
            "color": "0x08000000"
          }
        ],
        "shadowMd": [
          {
            "x": 1,
            "y": 4,
            "blur": 5,
            "spread": 0,
            "color": "0x08000000"
          }
        ],
        "shadowLg": [
          {
            "x": 1,
            "y": 4,
            "blur": 5,
            "spread": 0,
            "color": "0x08000000"
          }
        ],
        "shadowXl": [
          {
            "x": 1,
            "y": 4,
            "blur": 5,
            "spread": 0,
            "color": "0x08000000"
          }
        ],
        "shadow2xl": [
          {
            "x": 1,
            "y": 4,
            "blur": 5,
            "spread": 0,
            "color": "0x08000000"
          }
        ]
      },
      "fontSans": "Architects Daughter, sans-serif",
      "fontSerif": "Georgia, serif",
      "fontMono": "\\"
    }
  }
}