{
  "$schema": "../manifests/themes.schema.json",
  "schemaVersion": 1,
  "generatedAt": "2026-05-04T02:47:31.311787Z",
  "id": "vintage-paper",
  "name": "Vintage Paper",
  "light": {
    "background": "0xFFF5F1E6",
    "foreground": "0xFF4A3F35",
    "card": "0xFFFFFCF5",
    "cardForeground": "0xFF4A3F35",
    "popover": "0xFFFFFCF5",
    "popoverForeground": "0xFF4A3F35",
    "primary": "0xFFA67C52",
    "primaryForeground": "0xFFFFFFFF",
    "secondary": "0xFFE2D8C3",
    "secondaryForeground": "0xFF5C4D3F",
    "muted": "0xFFECE5D8",
    "mutedForeground": "0xFF7D6B56",
    "accent": "0xFFD4C8AA",
    "accentForeground": "0xFF4A3F35",
    "destructive": "0xFFB54A35",
    "destructiveForeground": "0xFFFFFFFF",
    "border": "0xFFDBD0BA",
    "input": "0xFFDBD0BA",
    "ring": "0xFFA67C52",
    "chart1": "0xFFA67C52",
    "chart2": "0xFF8D6E4C",
    "chart3": "0xFF735A3A",
    "chart4": "0xFFB3906F",
    "chart5": "0xFFC0A080",
    "sidebar": "0xFFECE5D8",
    "sidebarForeground": "0xFF4A3F35",
    "sidebarPrimary": "0xFFA67C52",
    "sidebarPrimaryForeground": "0xFFFFFFFF",
    "sidebarAccent": "0xFFD4C8AA",
    "sidebarAccentForeground": "0xFF4A3F35",
    "sidebarBorder": "0xFFDBD0BA",
    "sidebarRing": "0xFFA67C52"
  },
  "dark": {
    "background": "0xFF2D2621",
    "foreground": "0xFFECE5D8",
    "card": "0xFF3A322C",
    "cardForeground": "0xFFECE5D8",
    "popover": "0xFF3A322C",
    "popoverForeground": "0xFFECE5D8",
    "primary": "0xFFC0A080",
    "primaryForeground": "0xFF2D2621",
    "secondary": "0xFF4A4039",
    "secondaryForeground": "0xFFECE5D8",
    "muted": "0xFF312B26",
    "mutedForeground": "0xFFC5BCAC",
    "accent": "0xFF59493E",
    "accentForeground": "0xFFECE5D8",
    "destructive": "0xFFB54A35",
    "destructiveForeground": "0xFFFFFFFF",
    "border": "0xFF4A4039",
    "input": "0xFF4A4039",
    "ring": "0xFFC0A080",
    "chart1": "0xFFC0A080",
    "chart2": "0xFFB3906F",
    "chart3": "0xFFA67C52",
    "chart4": "0xFF8D6E4C",
    "chart5": "0xFF735A3A",
    "sidebar": "0xFF2D2621",
    "sidebarForeground": "0xFFECE5D8",
    "sidebarPrimary": "0xFFC0A080",
    "sidebarPrimaryForeground": "0xFF2D2621",
    "sidebarAccent": "0xFF59493E",
    "sidebarAccentForeground": "0xFFECE5D8",
    "sidebarBorder": "0xFF4A4039",
    "sidebarRing": "0xFFC0A080"
  },
  "tokens": {
    "light": {
      "radius": 0.25,
      "spacing": {
        "base": 3.84
      },
      "tracking": {
        "normal": 0
      },
      "shadows": {
        "shadow2xs": [
          {
            "x": 2,
            "y": 3,
            "blur": 5,
            "spread": 0,
            "color": "0x1F3A332C"
          }
        ],
        "shadowXs": [
          {
            "x": 2,
            "y": 3,
            "blur": 5,
            "spread": 0,
            "color": "0x1F3A332C"
          }
        ],
        "shadowSm": [
          {
            "x": 2,
            "y": 3,
            "blur": 5,
            "spread": 0,
            "color": "0x1F3A332C"
          }
        ],
        "shadow": [
          {
            "x": 2,
            "y": 3,
            "blur": 5,
            "spread": 0,
            "color": "0x1F3A332C"
          }
        ],
        "shadowMd": [
          {
            "x": 2,
            "y": 3,
            "blur": 5,
            "spread": 0,
            "color": "0x1F3A332C"
          }
        ],
        "shadowLg": [
          {
            "x": 2,
            "y": 3,
            "blur": 5,
            "spread": 0,
            "color": "0x1F3A332C"
          }
        ],
        "shadowXl": [
          {
            "x": 2,
            "y": 3,
            "blur": 5,
            "spread": 0,
            "color": "0x1F3A332C"
          }
        ],
        "shadow2xl": [
          {
            "x": 2,
            "y": 3,
            "blur": 5,
            "spread": 0,
            "color": "0x1F3A332C"
          }
        ]
      },
      "fontSans": "Libre Baskerville, serif",
      "fontSerif": "Lora, serif",
      "fontMono": "IBM Plex Mono, monospace"
    },
    "dark": {
      "radius": 0.25,
      "spacing": {
        "base": 3.84
      },
      "tracking": {
        "normal": 0
      },
      "shadows": {
        "shadow2xs": [
          {
            "x": 20.5,
            "y": 16.5,
            "blur": 25.5,
            "spread": -30,
            "color": "0x12000000"
          }
        ],
        "shadowXs": [
          {
            "x": 20.5,
            "y": 16.5,
            "blur": 25.5,
            "spread": -30,
            "color": "0x12000000"
          }
        ],
        "shadowSm": [
          {
            "x": 20.5,
            "y": 16.5,
            "blur": 25.5,
            "spread": -30,
            "color": "0x12000000"
          }
        ],
        "shadow": [
          {
            "x": 20.5,
            "y": 16.5,
            "blur": 25.5,
            "spread": -30,
            "color": "0x12000000"
          }
        ],
        "shadowMd": [
          {
            "x": 20.5,
            "y": 16.5,
            "blur": 25.5,
            "spread": -30,
            "color": "0x12000000"
          }
        ],
        "shadowLg": [
          {
            "x": 20.5,
            "y": 16.5,
            "blur": 25.5,
            "spread": -30,
            "color": "0x12000000"
          }
        ],
        "shadowXl": [
          {
            "x": 20.5,
            "y": 16.5,
            "blur": 25.5,
            "spread": -30,
            "color": "0x12000000"
          }
        ],
        "shadow2xl": [
          {
            "x": 20.5,
            "y": 16.5,
            "blur": 25.5,
            "spread": -30,
            "color": "0x12000000"
          }
        ]
      }
    }
  }
}