{
  "$schema": "../manifests/themes.schema.json",
  "schemaVersion": 1,
  "generatedAt": "2026-05-04T02:47:31.311787Z",
  "id": "neo-brutalism",
  "name": "Neo Brutalism",
  "light": {
    "background": "0xFFFFFFFF",
    "foreground": "0xFF000000",
    "card": "0xFFFFFFFF",
    "cardForeground": "0xFF000000",
    "popover": "0xFFFFFFFF",
    "popoverForeground": "0xFF000000",
    "primary": "0xFFFF3333",
    "primaryForeground": "0xFFFFFFFF",
    "secondary": "0xFFFFFF00",
    "secondaryForeground": "0xFF000000",
    "muted": "0xFFF0F0F0",
    "mutedForeground": "0xFF333333",
    "accent": "0xFF0066FF",
    "accentForeground": "0xFFFFFFFF",
    "destructive": "0xFF000000",
    "destructiveForeground": "0xFFFFFFFF",
    "border": "0xFF000000",
    "input": "0xFF000000",
    "ring": "0xFFFF3333",
    "chart1": "0xFFFF3333",
    "chart2": "0xFFFFFF00",
    "chart3": "0xFF0066FF",
    "chart4": "0xFF00CC00",
    "chart5": "0xFFCC00CC",
    "sidebar": "0xFFF0F0F0",
    "sidebarForeground": "0xFF000000",
    "sidebarPrimary": "0xFFFF3333",
    "sidebarPrimaryForeground": "0xFFFFFFFF",
    "sidebarAccent": "0xFF0066FF",
    "sidebarAccentForeground": "0xFFFFFFFF",
    "sidebarBorder": "0xFF000000",
    "sidebarRing": "0xFFFF3333"
  },
  "dark": {
    "background": "0xFF000000",
    "foreground": "0xFFFFFFFF",
    "card": "0xFF333333",
    "cardForeground": "0xFFFFFFFF",
    "popover": "0xFF333333",
    "popoverForeground": "0xFFFFFFFF",
    "primary": "0xFFFF6666",
    "primaryForeground": "0xFF000000",
    "secondary": "0xFFFFFF33",
    "secondaryForeground": "0xFF000000",
    "muted": "0xFF1A1A1A",
    "mutedForeground": "0xFFCCCCCC",
    "accent": "0xFF3399FF",
    "accentForeground": "0xFF000000",
    "destructive": "0xFFFFFFFF",
    "destructiveForeground": "0xFF000000",
    "border": "0xFFFFFFFF",
    "input": "0xFFFFFFFF",
    "ring": "0xFFFF6666",
    "chart1": "0xFFFF6666",
    "chart2": "0xFFFFFF33",
    "chart3": "0xFF3399FF",
    "chart4": "0xFF33CC33",
    "chart5": "0xFFCC33CC",
    "sidebar": "0xFF000000",
    "sidebarForeground": "0xFFFFFFFF",
    "sidebarPrimary": "0xFFFF6666",
    "sidebarPrimaryForeground": "0xFF000000",
    "sidebarAccent": "0xFF3399FF",
    "sidebarAccentForeground": "0xFF000000",
    "sidebarBorder": "0xFFFFFFFF",
    "sidebarRing": "0xFFFF6666"
  },
  "tokens": {
    "light": {
      "radius": 0,
      "spacing": {
        "base": 3.84
      },
      "tracking": {
        "normal": 0
      },
      "shadows": {
        "shadow2xs": [
          {
            "x": 4,
            "y": 4,
            "blur": 0,
            "spread": 0,
            "color": "0xFF000000"
          }
        ],
        "shadowXs": [
          {
            "x": 4,
            "y": 4,
            "blur": 0,
            "spread": 0,
            "color": "0xFF000000"
          }
        ],
        "shadowSm": [
          {
            "x": 4,
            "y": 4,
            "blur": 0,
            "spread": 0,
            "color": "0xFF000000"
          }
        ],
        "shadow": [
          {
            "x": 4,
            "y": 4,
            "blur": 0,
            "spread": 0,
            "color": "0xFF000000"
          }
        ],
        "shadowMd": [
          {
            "x": 4,
            "y": 4,
            "blur": 0,
            "spread": 0,
            "color": "0xFF000000"
          }
        ],
        "shadowLg": [
          {
            "x": 4,
            "y": 4,
            "blur": 0,
            "spread": 0,
            "color": "0xFF000000"
          }
        ],
        "shadowXl": [
          {
            "x": 4,
            "y": 4,
            "blur": 0,
            "spread": 0,
            "color": "0xFF000000"
          }
        ],
        "shadow2xl": [
          {
            "x": 4,
            "y": 4,
            "blur": 0,
            "spread": 0,
            "color": "0xFF000000"
          }
        ]
      },
      "fontSans": "DM Sans, sans-serif",
      "fontMono": "Space Mono, monospace"
    },
    "dark": {
      "radius": 0,
      "spacing": {
        "base": 3.84
      },
      "tracking": {
        "normal": 0
      },
      "shadows": {
        "shadow2xs": [
          {
            "x": 20.5,
            "y": 16.5,
            "blur": 25.5,
            "spread": -30,
            "color": "0x12000000"
          }
        ],
        "shadowXs": [
          {
            "x": 20.5,
            "y": 16.5,
            "blur": 25.5,
            "spread": -30,
            "color": "0x12000000"
          }
        ],
        "shadowSm": [
          {
            "x": 20.5,
            "y": 16.5,
            "blur": 25.5,
            "spread": -30,
            "color": "0x12000000"
          }
        ],
        "shadow": [
          {
            "x": 20.5,
            "y": 16.5,
            "blur": 25.5,
            "spread": -30,
            "color": "0x12000000"
          }
        ],
        "shadowMd": [
          {
            "x": 20.5,
            "y": 16.5,
            "blur": 25.5,
            "spread": -30,
            "color": "0x12000000"
          }
        ],
        "shadowLg": [
          {
            "x": 20.5,
            "y": 16.5,
            "blur": 25.5,
            "spread": -30,
            "color": "0x12000000"
          }
        ],
        "shadowXl": [
          {
            "x": 20.5,
            "y": 16.5,
            "blur": 25.5,
            "spread": -30,
            "color": "0x12000000"
          }
        ],
        "shadow2xl": [
          {
            "x": 20.5,
            "y": 16.5,
            "blur": 25.5,
            "spread": -30,
            "color": "0x12000000"
          }
        ]
      }
    }
  }
}